"Game-Based Social Interaction Platform for Cognitive Assessment of Autism Using Eye Tracking","Y. -L. Chien; C. -H. Lee; Y. -N. Chiu; W. -C. Tsai; Y. -C. Min; Y. -M. Lin; J. -S. Wong; Y. -L. Tseng","Department of Psychiatry, National Taiwan University Hospital, Taipei, Taiwan; Department of Electrical Engineering, Fu Jen Catholic University, New Taipei City, Taiwan; Department of Psychiatry, National Taiwan University Hospital, Taipei, Taiwan; Department of Psychiatry, National Taiwan University Hospital, Taipei, Taiwan; Department of Electrical Engineering, Fu Jen Catholic University, New Taipei City, Taiwan; Department of Electrical Engineering, Fu Jen Catholic University, New Taipei City, Taiwan; Department of Electrical Engineering, Fu Jen Catholic University, New Taipei City, Taiwan; Department of Electrical Engineering, National Sun Yat-sen University, Kaohsiung, Taiwan",IEEE Transactions on Neural Systems and Rehabilitation Engineering,"2 Feb 2023","2023","31","","749","758","The design goals of recently developed serious games are to improve attention, affective recognition, and social interactions among individuals with autism. However, most previous studies on serious games used behavioral questionnaires to evaluate their effectiveness. The cognitive assessment of individuals with autism after behavioral intervention or drug treatment has become important because it provides promising biomarkers to assess improvement after cognitive intervention. In this study, we developed a game-based social interaction platform incorporating an eye-tracking system for children and preadolescents with autism. Three modules (focusing on gaze following, facial emotion recognition, and social interaction skills) are included in the platform; participants with autism learn these according to their cognitive abilities. The eye-tracking results showed decreased fixation durations when autistic children looked at positive emotional expressions and focused on multiple targets. Prolonged saccade durations and shorter fixation times for social-related facial emotion expressions were also found in preadolescents and teenagers with autism. Our findings suggest that these atypical gaze patterns are reliable biomarkers for evaluating the social and cognitive functions of autistic individuals while playing serious games. The proposed platform’s game-based modules and the findings regarding aberrant gaze patterns in autistic individuals demonstrate the possibility of evaluating cognitive functions and intervention effectiveness by using eye-tracking signals in a serious game or real-life environment.","1558-0210","","10.1109/TNSRE.2022.3232369","Taiwan National Science and Technology Council(grant numbers:107-2221-E-110-081-MY3,110-2222-E-110-007-MY2); ","https://ieeexplore.ieee.org/stamp/stamp.jsp?arnumber=10000269","Social interaction game;autism spectrum disorder;eye tracking;serious games","Games;Emotion recognition;Gaze tracking;Autism;Pediatrics;Face recognition;Biomarkers","","27","","56","CCBY","28 Dec 2022","2023","","IEEE","IEEE Journals"
"Robot-Based Intervention for Children With Autism Spectrum Disorder: A Systematic Literature Review","K. D. Bartl-Pokorny; M. Pykała; P. Uluer; D. E. Barkana; A. Baird; H. Kose; T. Zorcec; B. Robins; B. W. Schuller; A. Landowska","EIHW–Chair of Embedded Intelligence for Health Care and Wellbeing, University of Augsburg, Augsburg, Germany; Department of Software Engineering, Faculty of Electronics, Telecommunications and Informatics, Gdansk University of Technology, Gdansk, Poland; Faculty of Engineering and Technology, Galatasaray University, Istanbul, Turkey; Department of Electrical and Electronics Engineering, Faculty of Engineering, Yeditepe University, Istanbul, Turkey; EIHW–Chair of Embedded Intelligence for Health Care and Wellbeing, University of Augsburg, Augsburg, Germany; Faculty of Computer and Informatics, Istanbul Technical University, Istanbul, Turkey; University Children’s Hospital, Skopje, North Macedonia; School of Computer Science, University of Hertfordshire, Hatfield, U.K.; EIHW–Chair of Embedded Intelligence for Health Care and Wellbeing, University of Augsburg, Augsburg, Germany; Department of Software Engineering, Faculty of Electronics, Telecommunications and Informatics, Gdansk University of Technology, Gdansk, Poland",IEEE Access,"21 Dec 2021","2021","9","","165433","165450","Children with autism spectrum disorder (ASD) have deficits in the socio-communicative domain and frequently face severe difficulties in the recognition and expression of emotions. Existing literature suggested that children with ASD benefit from robot-based interventions. However, studies varied considerably in participant characteristics, applied robots, and trained skills. Here, we reviewed robot-based interventions targeting emotion-related skills for children with ASD following the guidelines of the Preferred Reporting Items for Systematic Reviews and Meta-Analyses (PRISMA) statement. We systematically searched for all relevant articles published in English language until May 2021, using the databases Scopus, Web of Science, and PubMed. From a total of 609 identified papers, 60 publications including 50 original articles and 10 non-empirical articles including review articles and theoretical articles were eligible for the synthesis. A total of 892 participants were included in the robot-based intervention studies; 570 of them were children with ASD. Nao and ZECA were the most frequently used robots; recognition of basic emotions and getting into interaction were the most frequently trained skills, while happiness, sadness, fear, and anger were the most frequently trained emotions. The studies reported a wide range of challenges with respect to robot-based intervention, ranging from limitations for certain ASD subgroups and security aspects of the robots to efforts regarding the automatic recognition of the children’s emotional state by the robotic systems. Finally, we summarised and discussed recommendations regarding the application of robot-based interventions for children with ASD.","2169-3536","","10.1109/ACCESS.2021.3132785","European Commission’s Erasmus+ Project (EMBOA, Affective loop in socially assistive robotics as an intervention tool for children with autism)(grant numbers:2019-1-PL01-KA203-065096); ","https://ieeexplore.ieee.org/stamp/stamp.jsp?arnumber=9635826","Autism spectrum disorder;child-robot interaction;emotion expression;emotion recognition;intervention;socio-communicative abilities","Robots;Systematics;Autism;Bibliographies;Emotion recognition;Tagging;Search engines","","56","","66","CCBY","3 Dec 2021","2021","","IEEE","IEEE Journals"
"Enhancing Communication for People with Autism Through the Design of a Context-Aware Mobile Application for PECS","F. E. Z. El Arbaoui; K. El Hari; R. Saidi","SI2M Laboratory, National Institute of Statistics and Applied Economics (INSEA), Rabat, Morocco; SI2M Laboratory, National Institute of Statistics and Applied Economics (INSEA), Rabat, Morocco; SI2M Laboratory, National Institute of Statistics and Applied Economics (INSEA), Rabat, Morocco",Journal of ICT Standardization,"28 Nov 2024","2024","12","3","243","270","Autism is a neurodevelopmental condition characterized by difficulties with social skills and communication. Autistic individuals require different types of assistance to cope with these challenges. The Picture Exchange Communication System (PECS) is a commonly used program for teaching nonverbal and symbolic communication skills, particularly for children with limited or no communication abilities. However, despite the development of various technology-based PECS systems, there is a lack of features that can simplify their use by children with autism. In our work, we are developing a design of a personalized and context-aware PECS system. Our system not only presents pictures as content but also adapts and enhances the content using contextual information.","2246-0853","","10.13052/jicts2245-800X.1231","","https://ieeexplore.ieee.org/stamp/stamp.jsp?arnumber=10770619","Autism;IoT;PECS;context aware system;mobile application;sensing technology;autism spectrum disorder","Autism;Communication systems;Education;Standardization;Mobile applications;Information and communication technology","","","","42","","28 Nov 2024","September 2024","","River Publishers","River Publishers Journals"
"Exploring Sparse Gaussian Processes for Bayesian Optimization in Convolutional Neural Networks for Autism Classification","S. Cheekaty; G. Muneeswari","School of Computer Science and Engineering, VIT-AP University, Amaravati, Andhra Pradesh, India; School of Computer Science and Engineering, VIT-AP University, Amaravati, Andhra Pradesh, India",IEEE Access,"22 Jan 2024","2024","12","","10631","10651","Autism Spectrum Disorder (ASD) constitutes a prevalent childhood condition, impacting approximately 0.62% of the global population. Children grappling with ASD encounter challenges in acquiring language proficiency, comprehending spoken communication, and interpreting nonverbal cues, including eye contact, facial expressions, and hand gestures. This discourse delves into the application of eye tracking as a foundational instrument in ASD screening, leveraging the distinctive attributes of gaze behavior. Within the realm of Artificial Intelligence, Deep Learning manifests substantial promise, exhibiting considerable strides across diverse domains and emerging as an indispensable technological paradigm. This treatise introduces an innovative Convolutional Neural Network (CNN) model predicated on Bayesian optimization for the discernment of eye tracking images. The model comprises two primary components: the initial segment employs CNN to extract and amalgamate salient features, while the subsequent section incorporates a Bayesian optimizer tasked with fine-tuning the CNN’s hyperparameters contingent on an objective function. In the preliminary analysis, three distinct scenarios devoid of specific elements are juxtaposed with Bayesian optimization. During the examination, these circumstances are assessed through convergence charts and metrics of accuracy. The algorithm proposed manifests an elevated performance, demonstrating a conspicuous accuracy threshold of % during the evaluative phase of the model. This outcome constitutes a commendable advancement in research, accentuating the efficacy and resilience of the developed approach. The article undertakes a comparative analysis of research methodologies and thematic analysis approaches, furnishing valuable insights for qualitative researchers and offering methodologically robust pathways to address research inquiries. In practical applications, the model attests to heightened reliability and precision, thereby underscored as efficacious in real-world scenarios.","2169-3536","","10.1109/ACCESS.2024.3351168","","https://ieeexplore.ieee.org/stamp/stamp.jsp?arnumber=10384338","Autism spectrum disorders;Bayesian optimization;convolutional neural network;eye tracking;image classification","Autism;Gaze tracking;Bayes methods;Optimization;Metadata;Task analysis;Genetics;Convolutional neural networks;Image classification","","8","","42","CCBYNCND","8 Jan 2024","2024","","IEEE","IEEE Journals"
"Personalized Training via Serious Game to Improve Daily Living Skills in Pediatric Patients With Autism Spectrum Disorder","E. Vallefuoco; C. Bravaccio; G. Gison; L. Pecchia; A. Pepino","SInAPSi Centre, University of Naples Federico II, Naples, Italy; Department of Translational Medical Sciences, University of Naples Federico II, Naples, Italy; Department of Mental, Physical Health and Preventive Medicine, University of Campania Luigi Vanvitelli, Naples, Italy; School of Engineering, University of Warwick, Coventry, U.K.; Department of Electrical Engineering and Information Technology, University of Naples Federico II, Naples, Italy",IEEE Journal of Biomedical and Health Informatics,"1 Jul 2022","2022","26","7","3312","3322","The majority of people with Autism Spectrum Disorder (ASD) exhibit difficulties in social communication and behavior, which hinder their learning capability, amid others. Among technological solutions for people with ASD, serious games are frequently used to enhance learning of specific skills and instructional contents. However, because of heterogeneity in applications and game design, few studies have investigated their use in training daily activities. This paper presents a 3D personalized serious game we developed and validated to help ASD patients practice with shopping activities. Personalized training is paramount in people with ASD, thus several elements of this game were personalized to improve engagement and therefore the effectiveness of the virtual training. In order to assess the validity of the game, ten subjects (age $\text{11.9} \pm \text{2.7}$, 20% female) with ASD played ten sessions of the serious game, once per week. The participants underwent a real-life experience pre- and post-training in a real-life supermarket. Changes in daily living skills among participants were evaluated through specific tools: a form based on the International Classification of Functioning, Disability and Health for Children and Youth; and the Vineland Adaptive Behavior Scale II. Significant improvements (p$< $0.05) were detected in the main skills trained with the serious game, especially in learning the shopping procedure, directing attention, and problem-solving skills. These findings suggest that personalized serious games can represent a prominent tool to enhance daily living skills, but future work should clinically validate their efficacy.","2168-2208","","10.1109/JBHI.2022.3155367","","https://ieeexplore.ieee.org/stamp/stamp.jsp?arnumber=9723562","Serious games;Autism spectrum disorder;daily living skills;human-computer interactions","Games;Training;Variable speed drives;Bioinformatics;Pediatrics;Task analysis;Medical diagnostic imaging","Adolescent;Attention;Autism Spectrum Disorder;Child;Communication;Female;Humans;Male","41","","43","CCBY","1 Mar 2022","July 2022","","IEEE","IEEE Journals"
"AI4ASC: A Hierarchical Multi-Level AI-Driven Framework for Gesture Analysis and Monitoring in ASC Children","G. Cicceri; R. Maisano; G. Domenico Tripodi; G. Tartarisco; S. Vitabile; G. Pioggia; L. Ruta; S. Distefano","Department of Biomedicine, Neuroscience and Advanced Diagnostics (BiND), University of Palermo, Palermo, Italy; CIAM-Segreteria Tecnica Sistemi e Servizi Informatici, University of Messina, Messina, Italy; Department of Mathematics, Computer Sciences, Physics and Earth Sciences, University of Messina, Messina, Italy; National Research Council of Italy, Institute for Biomedical Research and Innovation (CNR-IRIB), Messina, Italy; Department of Biomedicine, Neuroscience and Advanced Diagnostics (BiND), University of Palermo, Palermo, Italy; National Research Council of Italy, Institute for Biomedical Research and Innovation (CNR-IRIB), Messina, Italy; National Research Council of Italy, Institute for Biomedical Research and Innovation (CNR-IRIB), Messina, Italy; Department of Mathematics, Computer Sciences, Physics and Earth Sciences, University of Messina, Messina, Italy",IEEE Access,"6 Feb 2026","2026","14","","17885","17904","Autism is characterized by differences in communication and social interaction, where nonverbal behaviors such as gestures provide valuable indicators for understanding social communication development. Traditional gesture assessment methods heavily rely on manual video review, which is labor-intensive, error-prone, and lacks scalability. Artificial Intelligence (AI) is a powerful solution to enhance the accuracy of autism diagnosis and therapies by enabling continuous, objective analysis of children nonverbal behaviors, such as gestures, thereby improving the assessment of their social and communication skills. This work leverages computer vision for gesture recognition in autistic children diagnosis, proposing AI4ASC, a hierarchical, multi (four)-level AI framework for the automated analysis and monitoring of gestures in autistic children. It focuses on pointing gesture, one of the early indicators of social communication development, to identify behaviors in children that, according to clinical evidence, behave differently to neurotypical ones. Experimental results on real-world clinical videos show that AI4ASC achieves high performance across all system levels: child detection with 88.6% mAP, hand detection with 95.7% of precision, and pointing gesture classification with 97.4% of overall precision. The final clustering level consolidates detected gestures with precision and quantifies them for clinician-guided interpretation. A user-friendly graphical interface and a client–server architecture enable therapist interaction and validation, supporting the integration of AI4ASC into clinical workflows for behavioral assessment.","2169-3536","","10.1109/ACCESS.2026.3659276","Italian Complementary National Plan PNC-I.1 “Research initiatives for Innovative Technologies and Pathways in the Health and Welfare Sector” D.D. 931 of June 2022, “DARE-DigitAl lifelong pRevEntion” Initiative, through Project DELPHI(grant numbers:PNC0000002,CUP: B53C22006460001); European Union-Next Generation EU-PNRR-Missione 4, Componente 2, Investimento 1.1-Bando PRIN 2022 PNRR-Decreto Direttoriale n. 1409 del 14-09-2022-Progetto RESILIENT(grant numbers:CUP J53D23015040001,P2022S4TTP); European Union’s NextGenerationEU Initiative through Italian Ministry of University and Research as part of the Piano nazionale di ripresa e resilienza (PNRR)-M4C2-I1.3 Project PE00000019 “Health Extended ALliance for Innovative Therapies, Advanced Laboratory-Research, and Integrated Approaches of Precision Medicine (HEAL ITALIA)”, Codice Unico di Progetto(grant numbers:(CUP) B73C22001250006); DREAM Project [PRIN–Ministero dell’Università e della Ricerca (MUR)](grant numbers:DSB.AD008.649); READS Project [Ministero delle Imprese e del Made in Italy (MIMIT)](grant numbers:F/180026/01-04/X43); INTER PARES Project, EU POC METRO 2014/2020 (Azione l.3.1.—Codice Progetto ME I.3.1.b.); ","https://ieeexplore.ieee.org/stamp/stamp.jsp?arnumber=11367655","Deep learning;autism spectrum condition;computer vision;gestures detection;pointing classification;clustering analysis","Autism;Accuracy;Medical treatment;Artificial intelligence;Videos;Monitoring;Pediatrics;Gesture recognition;Predictive models;Feature extraction","","","","33","CCBY","29 Jan 2026","2026","","IEEE","IEEE Journals"
"Transfer Learning and Hybrid Deep Convolutional Neural Networks Models for Autism Spectrum Disorder Classification From EEG Signals","N. K. Al-Qazzaz; A. A. Aldoori; A. K. Buniya; S. H. B. M. Ali; S. A. Ahmad","Department of Biomedical Engineering, Al-Khwarizmi College of Engineering, University of Baghdad, Baghdad, Iraq; Department of Biomedical Engineering, Al-Khwarizmi College of Engineering, University of Baghdad, Baghdad, Iraq; Department of Biomedical Engineering, Al-Khwarizmi College of Engineering, University of Baghdad, Baghdad, Iraq; Department of Electrical Electronic and Systems Engineering, Faculty of Engineering and Built Environment, Universiti Kebangsaan Malaysia (UKM), Bangi, Selangor, Malaysia; Department of Electrical and Electronic Engineering, Faculty of Engineering, Universiti Putra Malaysia (UPM), Serdang, Selangor, Malaysia",IEEE Access,"9 May 2024","2024","12","","64510","64530","Autism spectrum disorder (ASD) is a developmental disease characterised by restricted and repetitive behaviours, as well as difficulty in social communication and interaction, in children. The clinical diagnosis of ASD is reached by behavioural screening, which delays early intervention. Electroencephalography (EEG) is a method for analysing the brain’s electrical activity that has proven useful in the diagnosis of several neurological illnesses. Pre-trained deep Convolutional Neural Networks (CNNs) were used to extract features from the spectral profiles of the EEG dataset and classify patients into mild, moderate, and severe patients, as well as age-matched control subjects. Accordingly, the primary goal of this study is to use the pre-trained CNNs as classifiers in order to reap the benefits of transfer learning, and the secondary goal is to propose a hybrid model by employing decision tree (DT), K nearest neighbour (KNN), and a Support Vector Machine (SVM) machine learning classification techniques to categorise the features of the pre-trained CNN networks into mild, moderate, severe, and normal categories. The results show that using SqueezeNet for transfer learning improves classification accuracy to 85.5%, and that using SqueezeNet for hybrid models improves classification accuracy to 87.8% using SVM. Therefore, a hybrid model based on the combination of SqueezeNet and SVM might be utilised to automatically diagnose ASD based on the individual’s EEG data.","2169-3536","","10.1109/ACCESS.2024.3396869","Fundamental Research Grant Scheme (FRGS), Ministry of Higher Education, Malaysia(grant numbers:FRGS/1/2021/TK0/UPM/02/29); Universiti Kebangsaan Malaysia(grant numbers:DIP-2023-008); ","https://ieeexplore.ieee.org/stamp/stamp.jsp?arnumber=10520303","Autism;EEG;deep learning;transfer learning;convolutional neural networks;machine learning","Electroencephalography;Brain modeling;Autism;Feature extraction;Deep learning;Transfer learning;Task analysis;Convolutional neural networks;Machine learning","","32","","64","CCBYNCND","6 May 2024","2024","","IEEE","IEEE Journals"
"Toward Unbiased Facial Expression Recognition in the Wild via Cross-Dataset Adaptation","B. Han; W. -H. Yun; J. -H. Yoo; W. H. Kim","Electronics and Telecommunications Research Institute (ETRI), Daejeon, South Korea; Electronics and Telecommunications Research Institute (ETRI), Daejeon, South Korea; Electronics and Telecommunications Research Institute (ETRI), Daejeon, South Korea; Department of Computer Science and Engineering, The University of Texas at Arlington, Arlington, USA",IEEE Access,"9 Sep 2020","2020","8","","159172","159181","Despite various success in computer vision with facial images (e.g., face detection, recognition, and generation), facial expression recognition is still a challenging problem yet to be solved. This is because of simple but fundamental bottlenecks: 1) no global agreement on different facial expressions, 2) significant dataset biases that prevent cross-dataset analysis for a large-scale study, and 3) high class imbalance in in-the-wild datasets that causes inconsistency in predicting expressions in images using a machine learning algorithm. To tackle these issues, we propose a novel Deep Learning approach via adaptive cross-dataset scheme. We combine multiple in-the-wild datasets to secure sufficient training samples while minimizing dataset bias using ideas of reversal gradients to retain generality. For this, we introduce a flexible objective function that can control for skewed label distributions in the dataset. Incorporating these ideas, together with the ResNet pipeline as a backbone, we carried extensive experiments to validate our ideas using three independent in-the-wild facial expression datasets, which first confirmed bias from different datasets and yielded improved performance on facial expression recognition using the multi-site dataset.","2169-3536","","10.1109/ACCESS.2020.3018738","Institute of Information & Communications Technology Planning & Evaluation (IITP); Korea government (MSIT) (2019-0-00330, Development of AI Technology for Early Screening of Infant/Child Autism Spectrum Disorders based on Cognition of the Psychological Behavior and Response); ","https://ieeexplore.ieee.org/stamp/stamp.jsp?arnumber=9174732","Cross-dataset bias;deep learning;domain adaptation;facial expression recognition;in-the-wild dataset","Feature extraction;Face recognition;Training;Machine learning;Face;Entropy;Psychology","","19","","42","CCBY","24 Aug 2020","2020","","IEEE","IEEE Journals"
