"Automated Autism Assessment With Multimodal Data and Ensemble Learning: A Scalable and Consistent Robot-Enhanced Therapy Framework","I. Hassan; N. Nahid; M. Islam; S. Hossain; B. Schuller; M. A. R. Ahad","Kyushu Institute of Technology, Kitakyushu, Fukuoka, Japan; Kyushu Institute of Technology, Kitakyushu, Fukuoka, Japan; Department of Computer Science and Engineering, Ahsanullah University of Science and Technology, Dhaka, Bangladesh; Department of Computer Science and Digital Technology, University of East London, London, U.K.; TUM School of Computation, Information and Technology, Technical University of Munich, Munich, Germany; Department of Computer Science and Digital Technology, University of East London, London, U.K.",IEEE Transactions on Neural Systems and Rehabilitation Engineering,"31 Mar 2025","2025","33","","1191","1201","Navigating the complexities of Autism Spectrum Disorder (ASD) diagnosis and intervention requires a nuanced approach that addresses both the inherent variability in therapeutic practices and the imperative for scalable solutions. This paper presents a transformative Robot-Enhanced Therapy (RET) framework, leveraging an intricate amalgamation of an Adaptive Boosted 3D biomarker approach and Saliency Maps generated through Kernel Density Estimation. By seamlessly integrating these methodologies through majority voting, the framework pioneers a new frontier in automating the assessment of ASD levels and Autism Diagnostic Observation Schedule (ADOS) scores, offering unprecedented precision and efficiency. Drawing upon the rich tapestry of the DREAM Dataset, encompassing data from 61 children, this study meticulously crafts novel features derived from diverse modalities including body skeleton, head movement, and eye gaze data. Our 3D bio-marker approach achieves a remarkable predictive prowess, boasting a staggering 95.59% accuracy and an F1 score of 92.75% for ASD level prediction, alongside an RMSE of 1.78 and an R-squared value of 0.74 for ADOS score prediction. Furthermore, the introduction of a pioneering saliency map generation method, harnessing gaze data, further enhances predictive models, elevating ASD level prediction accuracy to an impressive 97.36%, with a corresponding F1 score of 95.56%. Beyond technical achievements, this study underscores RET’s transformative potential in reshaping ASD intervention paradigms, offering a promising alternative to Standard Human Therapy (SHT) by mitigating therapist variability and providing scalable therapeutic approaches. While acknowledging limitations in the research, such as sample constraints and model generalizability, our findings underscore RET’s capacity to revolutionize ASD management.","1558-0210","","10.1109/TNSRE.2025.3546519","","https://ieeexplore.ieee.org/stamp/stamp.jsp?arnumber=10906665","Autism;diagnosis;skeleton joint position;eye gaze;artificial intelligence","Autism;Medical treatment;Three-dimensional displays;Vectors;Skeleton;Training;Head;Gaze tracking;Feature extraction;Visualization","Humans;Robotics;Autism Spectrum Disorder;Child;Male;Algorithms;Female;Machine Learning;Autistic Disorder;Child, Preschool;Head Movements;Eye Movements;Fixation, Ocular;Databases, Factual;Ensemble Learning","5","","43","CCBYNCND","27 Feb 2025","2025","","IEEE","IEEE Journals"
"Technological Evolvement in AAC Modalities to Foster Communications of Verbally Challenged ASD Children: A Systematic Review","W. Farzana; F. Sarker; T. Chau; K. A. Mamun","Department of Computer Science and Engineering, Advanced Intelligent Multidisciplinary Systems (AIMS) Laboratory, United International University, Dhaka, Bangladesh; Department of Computer Science and Engineering, University of Liberal Arts Bangladesh, Dhaka, Bangladesh; Institute of Biomaterials and Biomedical Engineering, University of Toronto and Holland Bloorview Kids Rehabilitation Hospital, Toronto, ON, Canada; Department of Computer Science and Engineering, Advanced Intelligent Multidisciplinary Systems (AIMS) Laboratory, United International University, Dhaka, Bangladesh",IEEE Access,"21 Jul 2025","2025","13","","122943","122959","Augmentative and Alternative Communication (AAC) emerged as a combination of methods or strategies that constitute any device, such as Speech Generating Device (SGD), Program (mobile applications), Procedure (PECS, Picture Exchange Communication System), which enhances individual’s communication ability. Autism Spectrum Disorder (ASD) is a spectrum of comprehensive neurodevelopment disorder that leads to speech impairments, repetitive behavior, and social communication difficulties; therefore, it is imperative to underscore that at the core of all impediments are communication impairment. This article represents a systematic review of research initiatives that investigate multi-modal AAC strategies and functionality, features of mobile applications to reinforce communication and communal skills in verbally challenged ASD children because other researches are focused only on low or high-tech AAC or interventions to provide insights on ASD children respond to a particular approach. Following the PRISMA method, a total of 60 (January 2015 to October 2020) research articles were reviewed, indexed by Springer, Science Direct, Scopus, ACM, IEEE databases, and published in the AAC journal. The selected research articles are categorized into different themes where most of them focused on interactive mobile applications to improve emotional, social, learning, and overall communication skills in verbally challenged ASD children. This systematic review provides an outline of the paradigm shift in AAC modalities from PECS to Artificial Intelligence (AI), Machine Learning (ML), and Augmented Reality (AR) based applications. It opens up underline future opportunities to integrate intelligent analytics features in mobile applications to strengthen communication skills in verbally undermined ASD children.","2169-3536","","10.1109/ACCESS.2021.3055195","","https://ieeexplore.ieee.org/stamp/stamp.jsp?arnumber=9337853","Augmentative and alternative communication (AAC);autism spectrum disorder (ASD);mobile applications;machine learning (ML);artificial intelligence (AI);augmented reality (AR)","Mobile applications;Autism;Systematics;Monitoring;Machine learning;Databases;Augmented reality","","15","","89","CCBYNCND","28 Jan 2021","2025","","IEEE","IEEE Journals"
"A Preliminary Study on Effectiveness of a Standardized Multi-Robot Therapy for Improvement in Collaborative Multi-Human Interaction of Children With ASD","S. Ali; F. Mehmood; M. J. Khan; Y. Ayaz; U. Asgher; H. Sadia; E. Edifor; R. Nawaz","School of Mechanical and Manufacturing Engineering (SMME), National University of Sciences and Technology, Islamabad, Pakistan; School of Mechanical and Manufacturing Engineering (SMME), National University of Sciences and Technology, Islamabad, Pakistan; School of Mechanical and Manufacturing Engineering (SMME), National University of Sciences and Technology, Islamabad, Pakistan; School of Mechanical and Manufacturing Engineering (SMME), National University of Sciences and Technology, Islamabad, Pakistan; School of Mechanical and Manufacturing Engineering (SMME), National University of Sciences and Technology, Islamabad, Pakistan; Shifa International Hospitals Limited, Islamabad, Pakistan; Department of Operations, Technology, Events and Hospitality Management, Manchester Metropolitan University, Manchester, U.K.; Department of Computing, Mathematics and Digital Technology, Manchester Metropolitan University, Manchester, U.K.",IEEE Access,"22 Jun 2020","2020","8","","109466","109474","This research article presents a preliminary longitudinal study to check the improvement in multi-human communication of children with Autism Spectrum Disorder (ASD) using a standardized multi-robot therapy. The research is based on a 3 step framework: 1) Human-Human Interaction, Stage-1 (HHI-S1), 2) Human-Robot Interaction, Stage-2 (HRI-S2), and 3) Human-Human Interaction, Stage-3 (HHI-S3). All three stages of the therapy consist of two command sets: 1) Controls commands and 2) Evaluation commands (auditory commands, visual commands, and combination of both). The concept of multiple robots is introduced to help multi-human communication and discourage isolation in ASD children. The joint attention of an ASD child is improved by the robotic therapy in stage 2 considering it as a key parameter for a multi-human communication scenario. The improvement in joint attention results in better command following in a triad multi-human communication scenario in stage 3 as compared to stage 1. The proposed intervention has been tested on 8 ASD subjects with 10 sessions over a period of two and a half months (10 weeks). Each session of human-human interaction (stage 1 and 3) consisted of 14 cues whereas 18 cues were presented by each robot for human-robot interaction (stage 2). The results indicate an overall 86% improvement in the social communication skills of ASD children in case of a multi-human scenario. Validation of results and effectiveness of the therapy has been further accomplished through the use of the Childhood Autism Rating Scale (CARS) score.","2169-3536","","10.1109/ACCESS.2020.3001365","National University of Sciences and Technology, Islamabad, Pakistan; ","https://ieeexplore.ieee.org/stamp/stamp.jsp?arnumber=9113320","Autism spectrum disorder (ASD);multi-robots;human-robot interaction;robotic therapy","Robots;Medical treatment;Visualization;Autism;Human-robot interaction;Protocols;Collaboration","","18","","23","CCBY","10 Jun 2020","2020","","IEEE","IEEE Journals"
"Autism Detection of MRI Brain Images Using Hybrid Deep CNN With DM-Resnet Classifier","S. Jain; H. K. Tripathy; S. Mallik; H. Qin; Y. Shaalan; K. Shaalan","School of Computer Engineering, Kalinga Institute of Industrial Technology (Deemed to be University), Bhubaneswar, Odisha, India; School of Computer Engineering, Kalinga Institute of Industrial Technology (Deemed to be University), Bhubaneswar, Odisha, India; Department of Environmental Health, Harvard T. H. Chan School of Public Health, Boston, MA, USA; Department of Computer Science and Engineering, The University of Tennessee at Chattanooga, Chattanooga, TN, USA; Faculty of Medicine, Misr University for Science and Technology, 6th of October City, Egypt; Faculty of Engineering and IT, Dubai International Academic Cit, The British University in Dubai, Dubai, United Arab Emirates",IEEE Access,"30 Oct 2023","2023","11","","117741","117751","The neurodevelopmental Autism Spectrum Disorder (ASD) causes problems in social communication. Earlier diagnosis of ASD from brain image is necessary for reducing the effect of disorder. In this paper, deep Convolutional Neural Network (CNN) with Dwarf Mongoose optimized Residual Network (DM-ResNet) is proposed for the classification of autism disorder from Magnetic Resonance Imaging (MRI) brain images. Initially, the input brain images are preprocessed to remove the non-brain tissues. The preprocessed images are segmented with hybrid Fuzzy C Means (FCM) and Gaussian Mixture Model (GMM) which partition the image into sub groups to make it easier for classification by reducing the complexity. FCM-GMM segments the volume into predefined cortical and sub cortical regions. After segmentation, the features are extracted with Visual Geometry Group (VGG)-16 networks which comprised of several tiny kernels with filters for enhancing the depth of network and permit to extract complicated and discriminative features. Region of Interest (ROI) based functional connectivity feature is extracted with VGG-16 and these features are classified with DM optimized ResNet. The hyper parameters are optimized with DM optimization algorithm which improves the accuracy of classifier. By using the proposed approach, the accuracy of autism detection is improved to 99.83%.","2169-3536","","10.1109/ACCESS.2023.3325701","USA NSF(grant numbers:1761839,2200138); Catalyst Award from the USA National Academy of Medicine; AI Tennessee Initiative; University of Tennessee at Chattanooga; ","https://ieeexplore.ieee.org/stamp/stamp.jsp?arnumber=10287306","Autism detection;MRI images;segmentation;VGG feature extraction;ResNet;dwarf mongoose optimization","Feature extraction;Magnetic resonance imaging;Image segmentation;Autism;Signal processing algorithms;Deep learning;Classification algorithms","","61","","37","CCBYNCND","18 Oct 2023","2023","","IEEE","IEEE Journals"
"Characterizing Autism Spectrum Disorder Through Fusion of Local Cortical Activation and Global Functional Connectivity Using Game-Based Stimuli and a Mobile EEG System","Y. -L. Tseng; C. -H. Lee; Y. -N. Chiu; W. -C. Tsai; J. -S. Wang; W. -C. Wu; Y. -L. Chien","Department of Electrical Engineering, National Sun Yat-sen University, Kaohsiung, Taiwan; Department of Electrical Engineering, National Sun Yat-sen University, Kaohsiung, Taiwan; Department of Psychiatry, National Taiwan University Hospital, Taipei, Taiwan; Department of Psychiatry, National Taiwan University Hospital, Taipei, Taiwan; Department of Electrical Engineering, National Sun Yat-sen University, Kaohsiung, Taiwan; Department of Electrical Engineering, National Sun Yat-sen University, Kaohsiung, Taiwan; Department of Psychiatry, National Taiwan University Hospital, Taipei, Taiwan",IEEE Transactions on Neural Systems and Rehabilitation Engineering,"26 Aug 2024","2024","32","","3026","3035","The deficit in social interaction skills among individuals with autism spectrum disorder (ASD) is strongly influenced by personal experiences and social environments. Neuroimaging studies have previously highlighted the link between social impairment and brain activity in ASD. This study aims to develop a method for assessing and identifying ASD using a social cognitive game-based paradigm combined with electroencephalo-graphy (EEG) signaling features. Typically developing (TD) participants and autistic preadolescents and teenagers were recruited to participate in a social game while 12-channel EEG signals were recorded. The EEG signals underwent preprocessing to analyze local brain activities, including event-related potentials (ERPs) and time-frequency features. Additionally, the global brain network’s functional connectivity between brain regions was evaluated using phase-lag indices (PLIs). Subsequently, machine learning models were employed to assess the neurophysiological features. Results indicated pronounced ERP components, particularly the late positive potential (LPP), in parietal regions during social training. Autistic preadolescents and teenagers exhibited lower LPP amplitudes and larger P200 amplitudes compared to TD participants. Reduced theta synchronization was also observed in the ASD group. Aberrant functional connectivity within certain time intervals was noted in the ASD group. Machine learning analysis revealed that support-vector machines achieved a sensitivity of 100%, specificity of 91.7%, and accuracy of 95.8% as part of the performance evaluation when utilizing ERP and brain oscillation features for ASD characterization. These findings suggest that social interaction difficulties in autism are linked to specific brain activation patterns. Traditional behavioral assessments face challenges of subjectivity and accuracy, indicating the potential use of social training interfaces and EEG features for cognitive assessment in ASD.","1558-0210","","10.1109/TNSRE.2024.3417210","Taiwan National Science and Technology Council(grant numbers:112-2222-E-110-021); National Health Research Institutes(grant numbers:NHRI-EX113-11008PC); ","https://ieeexplore.ieee.org/stamp/stamp.jsp?arnumber=10639538","Electroencephalography;autism spectrum disorder;brain oscillations;functional connectivity;support-vector machine","Electroencephalography;Games;Face recognition;Oscillators;Task analysis;Synchronization;Autism","Humans;Autism Spectrum Disorder;Adolescent;Electroencephalography;Child;Male;Female;Evoked Potentials;Machine Learning;Cerebral Cortex;Video Games;Algorithms;Smartphone;Social Interaction","7","","94","CCBYNCND","20 Aug 2024","2024","","IEEE","IEEE Journals"
"Regional-Asymmetric Adaptive Graph Convolutional Neural Network for Diagnosis of Autism in Children With Resting-State EEG","W. Hu; G. Jiang; J. Han; X. Li; P. Xie","School of Electrical Engineering, Yanshan University, Qinhuangdao, China; School of Electrical Engineering, Yanshan University, Qinhuangdao, China; Beijing Key Laboratory of Learning and Cognition, School of Psychology, Capital Normal University, Beijing, China; State Key Laboratory of Cognitive Neuroscience and Learning, Beijing Normal University, Beijing, China; School of Electrical Engineering, Yanshan University, Qinhuangdao, China",IEEE Transactions on Neural Systems and Rehabilitation Engineering,"15 Jan 2024","2024","32","","200","211","Currently, resting-state electroencephalography (rs-EEG) has become an effective and low-cost evaluation way to identify autism spectrum disorders (ASD) in children. However, it is of great challenge to extract useful features from raw rs-EEG data to improve diagnosis performance. Traditional methods mainly rely on the design of manual feature extractors and classifiers, which are separately performed and cannot be optimized simultaneously. To this end, this paper proposes a new end-to-end diagnostic method based on a recently emerged graph convolutional neural network for the diagnosis of ASD in children. Inspired by related neuroscience findings on the abnormal brain functional connectivity and hemispheric asymmetry characteristics observed in autism patients, we design a new Regional-asymmetric Adaptive Graph Convolutional Neural Network (RAGNN). It utilizes a hierarchical feature extraction and fusion process to learn separable spatiotemporal EEG features from different brain regions, two hemispheres, and a global brain. In the temporal feature extraction section, we utilize a convolutional layer that spans from the brain area to the hemisphere. This allows for effectively capturing temporal features both within and between brain areas. To better capture spatial characteristics of multi-channel EEG signals, we employ adaptive graph convolutional learning to capture non-Euclidean features within the brain’s hemispheres. Additionally, an attention layer is introduced to highlight different contributions of the left and right hemispheres, and the fused features are used for classification. We conducted a subject-independent cross-validation experiment on rs-EEG data from 45 children with ASD and 45 typically developing (TD) children. Experimental results have shown that our proposed RAGNN model outperformed several existing deep learning-based methods (ShaollowNet, EEGNet, TSception, ST-GCN, and CGRU-MDGN).","1558-0210","","10.1109/TNSRE.2023.3347134","National Natural Science Foundation of China(grant numbers:62003228,61761166003); National Key Research and Development Program of China(grant numbers:2017YFC0820205); ","https://ieeexplore.ieee.org/stamp/stamp.jsp?arnumber=10373946","Autism spectrum disorders (ASD);resting-state electroencephalography (EEG);graph convolutional network;deep learning;computer-aided diagnosis","Feature extraction;Autism;Electroencephalography;Brain modeling;Convolution;Convolutional neural networks;Data models","Child;Humans;Autistic Disorder;Autism Spectrum Disorder;Brain;Electroencephalography;Neural Networks, Computer","16","","54","CCBY","25 Dec 2023","2024","","IEEE","IEEE Journals"
"A Multimodal Approach for Identifying Autism Spectrum Disorders in Children","J. Han; G. Jiang; G. Ouyang; X. Li","Beijing Key Laboratory of Learning and Cognition, School of Psychology, Capital Normal University, Beijing, China; School of Electrical Engineering, Yanshan University, Qinhuangdao, China; State Key Laboratory of Cognitive Neuroscience and Learning, Beijing Normal University, Beijing, China; State Key Laboratory of Cognitive Neuroscience and Learning, Beijing Normal University, Beijing, China",IEEE Transactions on Neural Systems and Rehabilitation Engineering,"22 Jul 2022","2022","30","","2003","2011","Identification of autism spectrum disorder (ASD) in children is challenging due to the complexity and heterogeneity of ASD. Currently, most existing methods mainly rely on a single modality with limited information and often cannot achieve satisfactory performance. To address this issue, this paper investigates from internal neurophysiological and external behavior perspectives simultaneously and proposes a new multimodal diagnosis framework for identifying ASD in children with fusion of electroencephalogram (EEG) and eye-tracking (ET) data. Specifically, we designed a two-step multimodal feature learning and fusion model based on a typical deep learning algorithm, stacked denoising autoencoder (SDAE). In the first step, two SDAE models are designed for feature learning for EEG and ET modality, respectively. Then, a third SDAE model in the second step is designed to perform multimodal fusion with learned EEG and ET features in a concatenated way. Our designed multimodal identification model can automatically capture correlations and complementarity from behavior modality and neurophysiological modality in a latent feature space, and generate informative feature representations with better discriminability and generalization for enhanced identification performance. We collected a multimodal dataset containing 40 ASD children and 50 typically developing (TD) children to evaluate our proposed method. Experimental results showed that our proposed method achieved superior performance compared with two unimodal methods and a simple feature-level fusion method, which has promising potential to provide an objective and accurate diagnosis to assist clinicians.","1558-0210","","10.1109/TNSRE.2022.3192431","National Natural Science Foundation of China(grant numbers:62003228,61761166003); Science and Technology Development Project of Beijing Municipal Education Commission of China(grant numbers:KM202010028019); National Key Research and Development Program of China(grant numbers:2017YFC0820205); ","https://ieeexplore.ieee.org/stamp/stamp.jsp?arnumber=9832930","Autism spectrum disorders (ASD);multimodal fusion;electroencephalogram (EEG);eye-tracking (ET);stacked denoising autoencoders;classification","Electroencephalography;Feature extraction;Behavioral sciences;Brain modeling;Variable speed drives;Pediatrics;Neuroimaging","Algorithms;Autism Spectrum Disorder;Child;Electroencephalography;Humans","101","","37","CCBY","19 Jul 2022","2022","","IEEE","IEEE Journals"
"Compound Emotion Recognition of Autistic Children During Meltdown Crisis Based on Deep Spatio-Temporal Analysis of Facial Geometric Features","S. K. Jarraya; M. Masmoudi; M. Hammami","CS Department, Faculty of Computing and Information Technology, King Abdulaziz University, Jeddah, Saudi Arabia; Mir@cl Laboratory, University of Sfax, Sfax, Tunisia; Mir@cl Laboratory, University of Sfax, Sfax, Tunisia",IEEE Access,"22 Apr 2020","2020","8","","69311","69326","An important contribution to computer vision applications has been made by recognizing human emotion. Although it is very significant, this work considers the security of autistic people while in meltdown crisis by introducing a new system to warn caregivers through facial expressions detection. A precautionary approach has been taken to deal with meltdown crisis. Certainly, the indications of Meltdown are linked to abnormal facial expressions related to compound emotions. Actually, researchers thought long ago that Human Facial Expressions (HFE) are not able to express more than the seven basics emotions. HFE have been considered by psychologists as very complicated one, which can indicate two or even more emotions known as compound or mixed ones. A few studies have been done concerning Compound Emotion (CE). As well as, many difficult tasks to detect Compound Emotion Recognition (CER). In this paper, we empirically assess a group of deep spatio-temporal geometric features of micro-expressions of autistic children during a meltdown crisis. To achieve this goal, we make a comparison of the CER performance and diverse collections of micro-expressions features to select the features which best differentiates autistic children CE in meltdown crisis from normal state, and the best classifier performance. We record autistic children videos in normal and meltdown crisis using Kinect camera in serious circumstances. The experimental evaluation shows that the deep spatio-temporal geometric features and Recurrent Neural Network RNN with 3 hidden layer using Information Gain Feature Selection methods provide best performance (85.8%).","2169-3536","","10.1109/ACCESS.2020.2986654","Deanship of Scientific Research (DSR), King Abdulaziz University, Jeddah(grant numbers:DF-350-165-1441); DSR technical and financial support; ","https://ieeexplore.ieee.org/stamp/stamp.jsp?arnumber=9060825","Autism;deep spatio-temporal features;meltdown crisis;facial expressions;compound emotions","Compounds;Emotion recognition;Autism;Cameras;Feature extraction;Face;Computer vision","","40","","42","CCBY","8 Apr 2020","2020","","IEEE","IEEE Journals"
